,news_title,news_details,news_date,source_name
192,अगस्ता वेस्टलैंड: दिल्ली हाईकोर्ट ने रतुल पुरी को 20 अगस्त तक अंतरिम राहत दी,अदालत ने ईडी से स्थिति रिपोर्ट दाखिल कर बताने को कहा कि पिछले हफ्ते पुरी को अग्रिम जमानत देने से इंकार किए जाने के बाद हेलीकॉप्टर सौदे से जुड़े धनशोधन मामले में ताजा स्थिति क्या है. 3600 करोड़ रूपए का यह सौदा रद्द कर दिया गया था. अदालत ने कहा कि स्थिति रिपोर्ट में यह बताया जाना चाहिए कि कथित धनशोधन में याचिकाकर्ता (पुरी) की वास्तव में क्या भूमिका रही है. ,"बुधवार अगस्त 14, 2019 09:47 PM IST",NDTV News
193,मनी लॉन्ड्रिंग मामल: पूर्व सांसद मीसा भारती के खिलाफ ईडी ने कोर्ट में दाखिल की सप्लीमेंट्री चार्जशीट,इस मामले में कारोबारी सुरेंद्र जैन की भी कोर्ट में पेशी हो चुकी है लेकिन उसे कोर्ट से जमानत मिली हुई है. याद हो कि ईडी ने इस मामले में मीसा भारती के दिल्ली स्थित एक फॉर्म हाउस को भी जब्त किया था. ईडी ने यह कार्रवाई कोर्ट के आदेश पर की थी. ,"बुधवार जुलाई 10, 2019 05:23 PM IST",NDTV News
194,ईडी ने मनी लॉन्डरिंग केस में IL&FS के दो पूर्व शीर्ष अधिकारियों को गिरफ्तार किया,मनी लॉन्डरिंग केस में ईडी ने आईएलएंडएफएस (इंफ्रास्ट्रक्चर लिजिंग एंड फाइनेंशियल सर्विसेज) के दो वरिष्ठ अधिकारियों को गिरफ्तार कर लिया है. जानकारी के मुताबिक ईडी ने आईएलएंडएफएस के पूर्व ज्वाइंट मैनेडिंग डायरेक्टर अरुण के साहा और आईएलएंडएफएस ट्रांसपोर्टेशन नेटवर्क के मैनेजिंग डायरेक्टर के रामचंद को गिरफ्तार किया है. ,"बुधवार जून 19, 2019 10:31 PM IST",NDTV News
195,"नीरव मोदी की रिमांड पर सुनवाई, जेल से वीडियो लिंक के जरिए होगा पेश",मोदी की जमानत की अर्जी मुख्य मजिस्ट्रेट एम्मा अर्बुथनॉट ने 29 मार्च को इस आधार पर खारिज कर दी थी कि इस बात का काफी जोखिम हैं कि वह सरेंडर नहीं करेगा. इस तरह के मामले में न्यायिक रिमंड के लिए समयसीमा 28 दिन की होती है.,"शुक्रवार अप्रैल 26, 2019 06:00 AM IST",NDTV News
196,"मनी लॉन्ड्रिंग मामला: रॉबर्ट वाड्रा को दिल्ली कोर्ट से मिली जमानत, देश छोड़कर नहीं जा सकेंगे",मनी लॉन्ड्रिंग मामले में दिल्ली की एक अदालत ने रॉबर्ट वाड्रा (Robert Vadra) को अग्रिम जमानत दे दी है. रॉबर्ट वाड्रा को 5 लाख रुपये निजी मुचलके पर ज़मानत दी गई है. कोर्ट ने रॉबर्ट वाड्रा (Robert Vadra News) को देश छोड़कर न जाने की शर्त पर जमानत दी है.,"सोमवार अप्रैल 1, 2019 04:58 PM IST",NDTV News
197,"ईडी ने धनशोधन मामले में रॉबर्ट वाड्रा को फिर तलब किया, लंदन में संपत्ति खरीद का है मामला",प्रवर्तन निदेशालय (ईडी) ने कांग्रेस अध्यक्ष राहुल गांधी के बहनोई राबर्ट वाड्रा को लंदन की 19 लाख पाउंड कीमत वाली एक संपत्ति के धनशोधन मामले में मंगलवार को पूछताछ के लिए दुबारा समन भेजा है.,"मंगलवार फ़रवरी 19, 2019 12:13 AM IST",NDTV News
198,"बड़ी मुश्किल में फंस सकते हैं रॉबर्ट वाड्रा, मनी लॉन्ड्रिंग और जमीन सौदों से जुड़े गंभीर आरोपों में कसता जा रहा है शिकंजा",कांग्रेस अध्यक्ष राहुल गांधी के बहनोई रॉबर्ट वाड्रा की मुश्किलें जल्द समाप्त होने वाली नहीं हैं क्योंकि जांच एजेंसियां उनकी स्काइलाइट हॉस्पिटेलिटी कंपनी से जुड़े विभिन्न मामलों में आने वाले दिनों में फिर उनसे पूछताछ कर सकती हैं. हाल ही में प्रवर्तन निदेशालय (ईडी) ने मनी लॉन्ड्रिंग के मामले में रॉबर्ट वाड्रा से तीन दिनों तक पूछताछ की.,"मंगलवार फ़रवरी 12, 2019 04:36 PM IST",NDTV News
199,"मनी लॉन्ड्रिंग केस: पहले दिन 5, दूसरे दिन 9 घंटे की पूछताछ के बाद आज फिर ED के सामने पेश हुए हैं रॉबर्ट वाड्रा",मनी लॉन्ड्रिंग मामले में जांच का सामने कर रहे प्रियंका गांधी के पति रॉबर्ट वाड्रा से आज एक बार फिर पूछताछ के लिए ईडी दफ्तर पहुंचे हैं.,"शनिवार फ़रवरी 9, 2019 12:17 PM IST",NDTV News
200,"डीके शिवकुमार की गिरफ्तारी से भड़के राहुल गांधी, मोदी सरकार पर लगाया यह आरोप...",डीके शिवकुमार (DK Shivakumar) की गिरफ्तारी को लेकर कांग्रेस के पूर्व अध्यक्ष राहुल गांधी ने मोदी सरकार पर बदले की राजनीति का आरोप लगाया.,"बुधवार सितम्बर 4, 2019 07:06 PM IST",NDTV News
201,"मनी लॉन्ड्रिंग मामले में ED की गिरफ्तारी से चिदंबरम को फिलहाल राहत, 5 सितंबर को सुप्रीम कोर्ट सुनाएगा फैसला",पूर्व वित्त मंत्री पी चिदंबरम (P Chidambaram) को आईएनएक्स (INX) मीडिया मनी लॉन्ड्रिंग मामले में ईडी की गिरफ्तारी से 5 सितंबर तक की राहत मिली है. प्रवर्तन निदेशालय (ED) द्वारा दायर किए गए केस में अग्रिम ज़मानत अर्ज़ी खारिज कर देने के दिल्ली हाईकोर्ट के फैसले के खिलाफ पी चिदंबरम (P Chidambaram) की अर्ज़ी पर सुप्रीम कोर्ट ने अपना फैसला 5 सितंबर तक के लिए सुरक्षित रख लिया है.,"गुरुवार अगस्त 29, 2019 05:18 PM IST",NDTV News
202,अगस्ता वेस्टलैंड: दिल्ली हाईकोर्ट ने रतुल पुरी को 20 अगस्त तक अंतरिम राहत दी,अदालत ने ईडी से स्थिति रिपोर्ट दाखिल कर बताने को कहा कि पिछले हफ्ते पुरी को अग्रिम जमानत देने से इंकार किए जाने के बाद हेलीकॉप्टर सौदे से जुड़े धनशोधन मामले में ताजा स्थिति क्या है. 3600 करोड़ रूपए का यह सौदा रद्द कर दिया गया था. अदालत ने कहा कि स्थिति रिपोर्ट में यह बताया जाना चाहिए कि कथित धनशोधन में याचिकाकर्ता (पुरी) की वास्तव में क्या भूमिका रही है. ,"बुधवार अगस्त 14, 2019 09:47 PM IST",NDTV News
203,मनी लॉन्ड्रिंग मामल: पूर्व सांसद मीसा भारती के खिलाफ ईडी ने कोर्ट में दाखिल की सप्लीमेंट्री चार्जशीट,इस मामले में कारोबारी सुरेंद्र जैन की भी कोर्ट में पेशी हो चुकी है लेकिन उसे कोर्ट से जमानत मिली हुई है. याद हो कि ईडी ने इस मामले में मीसा भारती के दिल्ली स्थित एक फॉर्म हाउस को भी जब्त किया था. ईडी ने यह कार्रवाई कोर्ट के आदेश पर की थी. ,"बुधवार जुलाई 10, 2019 05:23 PM IST",NDTV News
204,ईडी ने मनी लॉन्डरिंग केस में IL&FS के दो पूर्व शीर्ष अधिकारियों को गिरफ्तार किया,मनी लॉन्डरिंग केस में ईडी ने आईएलएंडएफएस (इंफ्रास्ट्रक्चर लिजिंग एंड फाइनेंशियल सर्विसेज) के दो वरिष्ठ अधिकारियों को गिरफ्तार कर लिया है. जानकारी के मुताबिक ईडी ने आईएलएंडएफएस के पूर्व ज्वाइंट मैनेडिंग डायरेक्टर अरुण के साहा और आईएलएंडएफएस ट्रांसपोर्टेशन नेटवर्क के मैनेजिंग डायरेक्टर के रामचंद को गिरफ्तार किया है. ,"बुधवार जून 19, 2019 10:31 PM IST",NDTV News
205,"नीरव मोदी की रिमांड पर सुनवाई, जेल से वीडियो लिंक के जरिए होगा पेश",मोदी की जमानत की अर्जी मुख्य मजिस्ट्रेट एम्मा अर्बुथनॉट ने 29 मार्च को इस आधार पर खारिज कर दी थी कि इस बात का काफी जोखिम हैं कि वह सरेंडर नहीं करेगा. इस तरह के मामले में न्यायिक रिमंड के लिए समयसीमा 28 दिन की होती है.,"शुक्रवार अप्रैल 26, 2019 06:00 AM IST",NDTV News
206,"मनी लॉन्ड्रिंग मामला: रॉबर्ट वाड्रा को दिल्ली कोर्ट से मिली जमानत, देश छोड़कर नहीं जा सकेंगे",मनी लॉन्ड्रिंग मामले में दिल्ली की एक अदालत ने रॉबर्ट वाड्रा (Robert Vadra) को अग्रिम जमानत दे दी है. रॉबर्ट वाड्रा को 5 लाख रुपये निजी मुचलके पर ज़मानत दी गई है. कोर्ट ने रॉबर्ट वाड्रा (Robert Vadra News) को देश छोड़कर न जाने की शर्त पर जमानत दी है.,"सोमवार अप्रैल 1, 2019 04:58 PM IST",NDTV News
207,"ईडी ने धनशोधन मामले में रॉबर्ट वाड्रा को फिर तलब किया, लंदन में संपत्ति खरीद का है मामला",प्रवर्तन निदेशालय (ईडी) ने कांग्रेस अध्यक्ष राहुल गांधी के बहनोई राबर्ट वाड्रा को लंदन की 19 लाख पाउंड कीमत वाली एक संपत्ति के धनशोधन मामले में मंगलवार को पूछताछ के लिए दुबारा समन भेजा है.,"मंगलवार फ़रवरी 19, 2019 12:13 AM IST",NDTV News
208,"बड़ी मुश्किल में फंस सकते हैं रॉबर्ट वाड्रा, मनी लॉन्ड्रिंग और जमीन सौदों से जुड़े गंभीर आरोपों में कसता जा रहा है शिकंजा",कांग्रेस अध्यक्ष राहुल गांधी के बहनोई रॉबर्ट वाड्रा की मुश्किलें जल्द समाप्त होने वाली नहीं हैं क्योंकि जांच एजेंसियां उनकी स्काइलाइट हॉस्पिटेलिटी कंपनी से जुड़े विभिन्न मामलों में आने वाले दिनों में फिर उनसे पूछताछ कर सकती हैं. हाल ही में प्रवर्तन निदेशालय (ईडी) ने मनी लॉन्ड्रिंग के मामले में रॉबर्ट वाड्रा से तीन दिनों तक पूछताछ की.,"मंगलवार फ़रवरी 12, 2019 04:36 PM IST",NDTV News
209,"मनी लॉन्ड्रिंग केस: पहले दिन 5, दूसरे दिन 9 घंटे की पूछताछ के बाद आज फिर ED के सामने पेश हुए हैं रॉबर्ट वाड्रा",मनी लॉन्ड्रिंग मामले में जांच का सामने कर रहे प्रियंका गांधी के पति रॉबर्ट वाड्रा से आज एक बार फिर पूछताछ के लिए ईडी दफ्तर पहुंचे हैं.,"शनिवार फ़रवरी 9, 2019 12:17 PM IST",NDTV News
210,दूसरों से सवाल पूछने की बजाय राहुल को जवाब देना चाहिए : प्रकाश जावड़ेकर,"रॉबर्ट वाड्रा से प्रवर्तन निदेशालय की पूछताछ को लेकर बीजेपी ने निशाना साधा है. केंद्रीय मानव संसाधन विकास मंत्री प्रकाश जावड़ेकर ने कहा, ""देश 'परिवार' से इस बात का जवाब चाहता है कि उन्होंने कितना लूटा है. यह विडम्बना है राहुल गांधी इस वक्त प्रधानमंत्री और सरकार से ढेरों सवाल पूछ रहे हैं, लेकिन वह उन सवालों के जवाब नहीं दे रहे हैं, जो देश पूछ रहा है...""","गुरुवार फ़रवरी 7, 2019 09:18 PM IST",NDTV News
211,रॉबर्ट वाड्रा का वह मेल जिसको लेकर ED उनसे कर रहा है पूछताछ,मनी लॉन्ड्रिग केस (Money Laundering Case) में रॉबर्ट वाड्रा (Robert Vadra) से प्रवर्तन निदेशालय (ED) पूछताछ कर रहा है. ईडी के पास ई मेल की कॉपी है जिसके बारे में उनसे पूछताछ हो रही है. सूत्रों के मुताबिक वाड्रा को सुमित चड्ढा ने एक मेल किया था जिसमें लंदन की प्रॉपर्टी का ज़िक्र है. इस मेल में वाड्रा से प्रॉपर्टी में होने वाले काम का भी ज़िक्र है.,"गुरुवार फ़रवरी 7, 2019 05:21 PM IST",NDTV News
212,"रॉबर्ट वाड्रा को अब पूछताछ के लिए शनिवार को बुलाया गया, शुक्रवार को नहीं होगी पूछताछ",मनी लॉन्ड्रिग केस (Money Laundering Case) के मामले में रॉबर्ट वाड्रा (Robert Vadra) से प्रवर्तन निदेशालय आज भी पूछताछ कर रहा है,"गुरुवार फ़रवरी 7, 2019 11:48 PM IST",NDTV News
213,राहुल गांधी से 4 सवाल पूछ BJP ने बोला हमला: एक रोडपति से करोड़पति कैसे बन गए रॉबर्ट वाड्रा?,भारतीय जनता पार्टी ने बुधवार को रॉबर्ट वाड्रा के हवाले से कांग्रेस पार्टी पर ताजा हमला बोला. भारतीय जनता पार्टी के प्रवक्ता संबित पात्रा ने प्रेस कॉन्फ्रेंस कर रॉबर्ट वाड्रा पर कई आरोप लगाए और कांग्रेस अध्यक्ष राहुल गांधी को भी निशाने पर लिया.,"बुधवार फ़रवरी 6, 2019 02:01 PM IST",NDTV News
214,"रॉबर्ट वाड्रा से पूछताछ का पहला दिन: 5 घंटे, 40 सवालों की बौछार, फिर भी आरोपों से इनकार, आज फिर बुलाया गया",कांग्रेस नेता सोनिया गांधी के दामाद रॉबर्ट वाड्रा (Robert Vadra) से ईडी दफ्तर में मनी लॉन्डरिंग से जुड़े मामले (Money Laundering Case) में पूछताछ खत्म हो गई है. रॉबर्ट वाड्रा को उनकी पत्नी और कांग्रेस नेता प्रियंका गांधी ईडी दफ्तर छोड़ने गईं थीं.,"गुरुवार फ़रवरी 7, 2019 11:11 AM IST",NDTV News
215,"Money laundering case: रॉबर्ट वाड्रा को राहत, कोर्ट ने दी 16 फरवरी तक अंतरिम जमानत",कांग्रेस अध्यक्ष राहुल गांधी के जीजा रॉबर्ट वाड्रा को प्रवर्तन निदेशालय द्वारा दर्ज मनी लांड्रिंग के एक मामले में कोर्ट ने राहत दी है.,"शनिवार फ़रवरी 2, 2019 02:28 PM IST",NDTV News
216,मनी लांड्रिंग मामले में राबर्ट वाड्रा ने अग्रिम जमानत के लिए अदालत का रूख किया ,"ईडी ने इन आरोपों का खारिज कर दिया था और कहा था, ""क्या किसी भी अधिकारी को किसी भी राजनीतिक रूप से बड़े व्यक्ति की जांच नहीं करनी चाहिए क्योंकि इसे राजनीतिक प्रतिशोध कहा जाएगा?"" जांच एजेंसी ने अदालत को बताया था कि भगोड़े हथियार व्यापारी संजय भंडारी के खिलाफ आयकर विभाग काला धन अधिनियम एवं कर कानून के तहत जांच कर रहा है. इसी दौरान अरोड़ा की भूमिका सामने आयी और इसके आधार पर धन शोधन का मामला दर्ज किया गया था.","शनिवार फ़रवरी 2, 2019 03:12 AM IST",NDTV News
217,धन शोधन मामले में अग्रिम जमानत के लिए अदालत पहुंचे रॉबर्ट वाड्रा,रॉबर्ट वाड्रा ने प्रवर्तन निदेशालय द्वारा दर्ज धन शोधन के एक मामले में अग्रिम जमानत के लिए शुक्रवार को दिल्ली की एक अदालत का रुख किया. अभियोजन दल के अधिवक्ता ने पुष्टि की कि वाड्रा ने उस मामले में अग्रिम जमानत मांगी है जिसमें उनके करीबी सहयोगी मनोज अरोड़ा को अदालत ने 6 फरवरी तक गिरफ्तारी से अंतरिम संरक्षण दिया था. ,"शुक्रवार फ़रवरी 1, 2019 11:32 PM IST",NDTV News
