,news_title,news_details,news_date,source_name
57,"गृहमंत्री अमित शाह की IAS अधिकारी के साथ फोटो शेयर करने पर बुरे फंसे फिल्ममेकर, पुलिस ने दर्ज किया केस",भारतीय प्रशासनिक सेवा (आईएएस) अधिकारी पूजा सिंघल के साथ केंद्रीय गृह मंत्री की तस्वीर साझा करने के मामले में फिल्मकार अविनाश दास के खिलाफ मामला दर्ज किया है.,"मंगलवार मई 17, 2022 07:41 AM IST",NDTV News
58,आईएएस पूजा सिंघल को ED ने मनी लांड्रिंग मामले में किया गिरफ्तार,झारखंड में तैनात आईएएस पूजा सिंघल को ईडी ने मनी लॉन्ड्रिंग मामले में गिरफ्तार कर लिया है. पूजा सिंघल झारखंड (Jharkhand)  की खनन सचिव हैं. उनसे खूंटी में मनरेगा के पैसों की कथित हेराफेरी से जुड़े धन शोधन के मामले में प्रवर्तन निदेशालय के सामने मंगलवार को पेश हुई थीं.,"बुधवार मई 11, 2022 07:20 PM IST",NDTV News
59,"ED ने माफिया सरगना मुख्‍तार अंसारी के भाई अफजाल से 10 घंटे की पूछताछ, कई सवालों का नहीं दे पाए जवाब","ईडी ने मुख्तार के खिलाफ जुलाई 2021 में मनी लांड्रिंग का केस दर्ज किया था. छानबीन के दौरान केंद्रीय जांच एजेंसी को पता चला है कि कुछ शख्स ऐसे हैं, जिनके जरिए मुख्तार, उसके बेटों और भाई अफजाल को पैसा पहुंचता है.","मंगलवार मई 10, 2022 06:48 PM IST",NDTV News
60,"दिल्ली के स्वास्थ्य मंत्री सत्येंद्र जैन की कोर्ट में पेशी आज, ईडी ने मनी लॉन्ड्रिंग मामले में किया था गिरफ्तार",दिल्‍ली की अरविंद केजरीवाल सरकार के मंत्री सत्‍येंद्र जैन (Satyendar Jain) को प्रवर्तन निदेशालय (ED) ने कथित मनी लांड्रिंग मामले में गिरफ्तार किया गया है. आप' के मंत्री के खिलाफ मनी लॉन्ड्रिंग का ईडी का मामला अगस्त 2017 में सीबीआई द्वारा उनके और अन्य के खिलाफ आय से अधिक संपत्ति रखने के आरोप में दर्ज की गई एफईआआर से उपजा है..,"मंगलवार मई 31, 2022 08:32 AM IST",NDTV News
61,"पाकिस्तान के PM शहबाज शरीफ ने कोर्ट में खुद को बताया 'मजनू', जानें- पूरा मामला",पाकिस्तान (Pakistan) के प्रधानमंत्री शहबाज शरीफ (Shehbaz Sharif) ने अपने खिलाफ दर्ज 16 अरब पाकिस्तानी रुपये के धनशोधन मामले में शनिवार को एक विशेष अदालत में कहा कि पंजाब का मुख्यमंत्री रहने के दौरान उन्होंने वेतन तक नहीं लिया और उन्होंने ऐसा ‘‘मजनू’’ होने के कारण किया.,"शनिवार मई 28, 2022 04:31 PM IST",NDTV News
62,जम्मू एवं कश्मीर के पूर्व CM फारूक अब्दुल्ला को ED ने मनी लॉन्डरिंग केस में पूछताछ के लिए 31 मई को तलब किया,प्रवर्तन निदेशालय (Enforcement Directorate) ने जम्मू एवं कश्मीर के पूर्व मुख्यमंत्री फारूक अब्दुल्ला को मनी लॉन्डरिंग केस में पूछताछ के लिए 31 मई को तलब किया है.,"शुक्रवार मई 27, 2022 12:22 PM IST",NDTV News
63,"चीनी वीजा मामला: ईडी ने कार्ति चिदंबरम, अन्य के खिलाफ धनशोधन का मामला दर्ज किया",ईडी (ED) ने 2011 में 263 चीनी नागरिकों को वीजा जारी किए जाने में कथित अनियमितता के सिलसिले में कांग्रेस सांसद कार्ति चिदंबरम (Karti Chidambaram) और अन्य के खिलाफ धनशोधन (Money Laundering) का मामला दर्ज किया है.,"बुधवार मई 25, 2022 05:40 PM IST",NDTV News
64,"मनी लॉन्ड्रिंग मामला: न्यायिक हिरासत में भेजी गईं निलंबित IAS पूजा सिंघल, ED की जांच जारी",प्रवर्तन निदेशालय ने सिंघल (44) को इस महीने की शुरुआत में गिरफ्तार किया था. उन्हें झारखंड के खूंटी जिले में महात्मा गांधी राष्ट्रीय ग्रामीण रोजगार गारंटी योजना (मनरेगा) निधि के कथित गबन और अन्य वित्तीय अनियमितताओं से जुड़े मनी लॉन्ड्रिंग मामले में गिरफ्तार किया गया था.,"बुधवार मई 25, 2022 03:01 PM IST",NDTV News
65,CM हेमंत सोरेन को खनन पट्टा आवंटन में पूजा सिंघल की थी भूमिका: ईडी ने हाईकोर्ट को बताया,सुप्रीम कोर्ट झारखंड के मुख्यमंत्री हेमंत सोरेन और उनके परिवार के सदस्यों तथा सहयोगियों द्वारा चलायी जा रही कुछ छद्म कंपनियों को खनन पट्टों की कथित मंजूरी की सीबीआई तथा प्रवर्तन निदेशालय की जांच से जुड़ी एक याचिका पर शुक्रवार को सुनवाई करने के लिए राजी हो गया है.,"शुक्रवार मई 20, 2022 08:14 AM IST",NDTV News
66,"""कई शेल कंपनियों के जरिए की गई मनी लॉन्ड्रिंग""- ED ने IAS पूजा सिंघल मामले में हाईकोर्ट को बताया",IAS पूजा सिंघल मामले में ईडी ने अदालत को ये भी बताया कि रवि केजरीवाल के बयान से संकेत मिलता है कि कई शेल कंपनियों का इस्तेमाल मनी लॉन्ड्रिंग के लिए किया गया था.,"बुधवार मई 18, 2022 10:07 AM IST",NDTV News
67,"गृहमंत्री अमित शाह की IAS अधिकारी के साथ फोटो शेयर करने पर बुरे फंसे फिल्ममेकर, पुलिस ने दर्ज किया केस",भारतीय प्रशासनिक सेवा (आईएएस) अधिकारी पूजा सिंघल के साथ केंद्रीय गृह मंत्री की तस्वीर साझा करने के मामले में फिल्मकार अविनाश दास के खिलाफ मामला दर्ज किया है.,"मंगलवार मई 17, 2022 07:41 AM IST",NDTV News
68,आईएएस पूजा सिंघल को ED ने मनी लांड्रिंग मामले में किया गिरफ्तार,झारखंड में तैनात आईएएस पूजा सिंघल को ईडी ने मनी लॉन्ड्रिंग मामले में गिरफ्तार कर लिया है. पूजा सिंघल झारखंड (Jharkhand)  की खनन सचिव हैं. उनसे खूंटी में मनरेगा के पैसों की कथित हेराफेरी से जुड़े धन शोधन के मामले में प्रवर्तन निदेशालय के सामने मंगलवार को पेश हुई थीं.,"बुधवार मई 11, 2022 07:20 PM IST",NDTV News
69,"ED ने माफिया सरगना मुख्‍तार अंसारी के भाई अफजाल से 10 घंटे की पूछताछ, कई सवालों का नहीं दे पाए जवाब","ईडी ने मुख्तार के खिलाफ जुलाई 2021 में मनी लांड्रिंग का केस दर्ज किया था. छानबीन के दौरान केंद्रीय जांच एजेंसी को पता चला है कि कुछ शख्स ऐसे हैं, जिनके जरिए मुख्तार, उसके बेटों और भाई अफजाल को पैसा पहुंचता है.","मंगलवार मई 10, 2022 06:48 PM IST",NDTV News
70,मनी लॉन्ड्रिंग मामले में ED ने सत्येंद्र जैन के खिलाफ चार्जशीट दाखिल की,"सीबीआई ने आरोप लगाया है कि जैन ने 14 फरवरी, 2015 से 31 मई, 2017 की अवधि के दौरान दिल्ली सरकार में मंत्री के पद पर रहते हुए, अपनी आय के ज्ञात स्रोतों से अधिक संपत्ति अर्जित की है.","बुधवार जुलाई 27, 2022 04:02 PM IST",NDTV News
71,जम्मू-कश्मीर के पूर्व सीएम फारूक अब्दुल्ला के खिलाफ मनी लांड्रिंग केस में चार्जशीट दाखिल,चार्जशीट जम्मू कश्मीर क्रिकेट एसोसिएशन में कथित वित्तीय अनियमितताओं से संबंधित मनी लॉन्ड्रिंग मामले में दायर की गई है. इस मामले में 84 साल के फारूक अब्दुल्ला से ईडी ने कई बार पूछताछ की है.,"मंगलवार जुलाई 26, 2022 04:28 PM IST",NDTV News
72,"ईडी ने मुंबई के पूर्व पुलिस कमिश्नर संजय पांडे को किया गिरफ्तार, एनएसई को-लोकेशन केस में मनी लांड्रिंग का आरोप",संजय पांडे (EX Mumbai police commissioner Sanjay Pandey) की यह गिरफ्तारी एनएसई को लोकेशन केस से जुड़े मनी लांड्रिंग के मामले में की गई है. को लोकेशन केस में नेशनल स्टॉक एक्सचेंज की पूर्व सीईओ चित्रा रामकृष्णन मुख्य आरोपी हैं. ,"बुधवार जुलाई 20, 2022 05:27 PM IST",NDTV News
73,"ED के सामने आज पेश नहीं होंगी सत्येंद्र जैन की पत्नी, खराब स्वास्थ्य का दिया हवाला : सूत्र","ED ने कोलकाता की एक कंपनी से जुड़े कथित हवाला लेनदेन के सिलसिले में दिल्ली सरकार में मंत्री सत्येंद्र जैन को 30 म‌ई को गिरफ्तार किया था. इसी मामले में ED ने सत्येंद्र की पत्नी पूनम जैन को भी 14 जुलाई के लिए तलब किया था, लेकिन खराब स्वास्थ्य का हवाला देकर पूनम जैन पूछताछ के लिए ED दफ़्तर नहीं पहुंच रहीं.","गुरुवार जुलाई 14, 2022 11:32 AM IST",NDTV News
74,"ईडी ने सोनिया गांधी को 21 जुलाई को पूछताछ के लिए बुलाया, नेशनल हेराल्ड मनी लांड्रिंग केस में होंगे सवाल-जवाब",नेशनल हेराल्‍ड मनी लांड्रिंग मामले को लेकर प्रवर्तन निदेशालय ने कांग्रेस अध्‍यक्ष सोनिया गांधी को पूछताछ के लिए नोटिस भेजा है. यह पूछताछ 21 जुलाई को होगी.ईडी ने इस मामले में सोनिया को 23 जून को पूछताछ के लिए तलब किया था लेकिन कोस्वास्थ्य संबंधी समस्याओं के चलते कांग्रेस अध्‍यक्ष ने पूछताछ को कुछ सप्‍ताह टालने का आग्रह किया था.,"सोमवार जुलाई 11, 2022 05:12 PM IST",NDTV News
75,एनएसई को-लोकेशन मामलाः ईडी ने मुंबई के पूर्व पुलिस आयुक्त संजय पांडे से पूछताछ की,वर्ष 1986 बैच के भारतीय पुलिस सेवा (आईपीएस) के अधिकारी पांडे 30 जून को सेवानिवृत्त हुए थे. मुंबई के पुलिस आयुक्त के रूप में एक मार्च से शुरू हुए अपने चार महीने के कार्यकाल से पहले उन्होंने महाराष्ट्र के कार्यवाहक पुलिस महानिदेशक के रूप में कार्य किया था.,"मंगलवार जुलाई 5, 2022 04:12 PM IST",NDTV News
76,"ED ने मुंबई के पूर्व पुलिस कमिश्नर संजय पांडे को किया तलब, 3 दिन पहले हुए हैं रिटायर",मुंबई के पूर्व पुलिस कमिश्नर संजय पांडे को 5 जुलाई को तलब किया है. मनी लांड्रिंग केस में जांच एजेंसी ने उन्हें समन भेजा है.,"सोमवार जुलाई 4, 2022 12:23 AM IST",NDTV News
77,दिल्ली के स्वास्थ्य मंत्री सत्येंद्र जैन की न्यायिक हिरासत 14 दिन के लिये बढ़ाई गई,धनशोधन के एक मामले (Money Laundering Case) में प्रवर्तन निदेशालय (ED) द्वारा गिरफ्तार किए गए दिल्ली के स्वास्थ्य मंत्री सत्येंद्र जैन (Satyendra Jain) की न्यायिक हिरासत सोमवार को यहां की एक अदालत ने दो सप्ताह के लिए बढ़ा दी.,"सोमवार जून 27, 2022 05:32 PM IST",NDTV News
78,मेरे पास हवाला का पैसा कहां है? : कांग्रेस की कर्नाटक इकाई के प्रमुख डी के शिवकुमार का दावा,धन शोधन मामले (Money Laundering Case) में अगले हफ्ते दिल्ली की एक अदालत में पेश होने वाले कांग्रेस की कर्नाटक इकाई के अध्यक्ष डी के शिवकुमार (DK Shivakumar) ने शुक्रवार को दावा किया कि उनके पास ‘हवाला का कोई पैसा’ नहीं है और अदालत मामले पर फैसला करेगी.,"शुक्रवार जून 24, 2022 06:47 PM IST",NDTV News
79,सोनिया गांधी ने ED से पूछताछ को कुछ सप्‍ताह टालने का किया अनुरोध,नेशनल हेराल्‍ड केस से संबंधित कथित मनी लांड्रिंग मामले में कांग्रेस अध्‍यक्ष सोनिया गांधी ने प्रवर्तन निदेशालय से पूछताछ को दो दिन टालने का आग्रह किया है. सोनिया को गुरुवार को प्रवर्तन निदेशालय के समक्ष पूछताछ के लिए तलब किया गया था.,"बुधवार जून 22, 2022 03:45 PM IST",NDTV News
80,"दिल्ली के स्वास्थ्य मंत्री सत्येंद्र जैन की कोर्ट में पेशी आज, ईडी ने मनी लॉन्ड्रिंग मामले में किया था गिरफ्तार",दिल्‍ली की अरविंद केजरीवाल सरकार के मंत्री सत्‍येंद्र जैन (Satyendar Jain) को प्रवर्तन निदेशालय (ED) ने कथित मनी लांड्रिंग मामले में गिरफ्तार किया गया है. आप' के मंत्री के खिलाफ मनी लॉन्ड्रिंग का ईडी का मामला अगस्त 2017 में सीबीआई द्वारा उनके और अन्य के खिलाफ आय से अधिक संपत्ति रखने के आरोप में दर्ज की गई एफईआआर से उपजा है..,"मंगलवार मई 31, 2022 08:32 AM IST",NDTV News
81,"पाकिस्तान के PM शहबाज शरीफ ने कोर्ट में खुद को बताया 'मजनू', जानें- पूरा मामला",पाकिस्तान (Pakistan) के प्रधानमंत्री शहबाज शरीफ (Shehbaz Sharif) ने अपने खिलाफ दर्ज 16 अरब पाकिस्तानी रुपये के धनशोधन मामले में शनिवार को एक विशेष अदालत में कहा कि पंजाब का मुख्यमंत्री रहने के दौरान उन्होंने वेतन तक नहीं लिया और उन्होंने ऐसा ‘‘मजनू’’ होने के कारण किया.,"शनिवार मई 28, 2022 04:31 PM IST",NDTV News
82,जम्मू एवं कश्मीर के पूर्व CM फारूक अब्दुल्ला को ED ने मनी लॉन्डरिंग केस में पूछताछ के लिए 31 मई को तलब किया,प्रवर्तन निदेशालय (Enforcement Directorate) ने जम्मू एवं कश्मीर के पूर्व मुख्यमंत्री फारूक अब्दुल्ला को मनी लॉन्डरिंग केस में पूछताछ के लिए 31 मई को तलब किया है.,"शुक्रवार मई 27, 2022 12:22 PM IST",NDTV News
83,"चीनी वीजा मामला: ईडी ने कार्ति चिदंबरम, अन्य के खिलाफ धनशोधन का मामला दर्ज किया",ईडी (ED) ने 2011 में 263 चीनी नागरिकों को वीजा जारी किए जाने में कथित अनियमितता के सिलसिले में कांग्रेस सांसद कार्ति चिदंबरम (Karti Chidambaram) और अन्य के खिलाफ धनशोधन (Money Laundering) का मामला दर्ज किया है.,"बुधवार मई 25, 2022 05:40 PM IST",NDTV News
84,"मनी लॉन्ड्रिंग मामला: न्यायिक हिरासत में भेजी गईं निलंबित IAS पूजा सिंघल, ED की जांच जारी",प्रवर्तन निदेशालय ने सिंघल (44) को इस महीने की शुरुआत में गिरफ्तार किया था. उन्हें झारखंड के खूंटी जिले में महात्मा गांधी राष्ट्रीय ग्रामीण रोजगार गारंटी योजना (मनरेगा) निधि के कथित गबन और अन्य वित्तीय अनियमितताओं से जुड़े मनी लॉन्ड्रिंग मामले में गिरफ्तार किया गया था.,"बुधवार मई 25, 2022 03:01 PM IST",NDTV News
85,CM हेमंत सोरेन को खनन पट्टा आवंटन में पूजा सिंघल की थी भूमिका: ईडी ने हाईकोर्ट को बताया,सुप्रीम कोर्ट झारखंड के मुख्यमंत्री हेमंत सोरेन और उनके परिवार के सदस्यों तथा सहयोगियों द्वारा चलायी जा रही कुछ छद्म कंपनियों को खनन पट्टों की कथित मंजूरी की सीबीआई तथा प्रवर्तन निदेशालय की जांच से जुड़ी एक याचिका पर शुक्रवार को सुनवाई करने के लिए राजी हो गया है.,"शुक्रवार मई 20, 2022 08:14 AM IST",NDTV News
