,news_title,news_details,news_date,source_name
113,"अनिल देशमुख की जमानत याचिका पर हाईकोर्ट 8 अप्रैल को करेगा सुनवाई , ED से जवाब मांगा",प्रिवेंशन ऑफ मनी लांड्रिंग एक्‍ट (PMLA) के तहत गिरफ्तार महाराष्‍ट्र के पूर्व गृहमंत्री अनिल देशमुख (Anil Deshmukh)  की जमानत अर्जी पर बॉम्‍बे हाईकोर्ट  में 8 अप्रैल को सुनवाई होगी.  बॉम्‍बे हाईकोर्ट ने प्रवर्तन निदेशालय (ED) को मामले में जवाब देने को कहा है.,"शुक्रवार मार्च 25, 2022 02:59 PM IST",NDTV News
114,"NCP ने नवाब मलिक के विभागों को अन्य मंत्रियों को सौंपने का निर्णय लिया, इस्तीफे से इनकार",राज्य सरकार में मलिक के पास कौशल विकास और अल्पसंख्यक मामलों का विभाग था. वह परभणी और गोंदिया जिले के पालक (गार्डियन) मंत्री भी हैं. पार्टी के एक वरिष्ठ नेता ने कहा कि कौशल विकास विभाग स्वास्थ्य मंत्री राजेश टोपे को दिया जाएगा और अल्पसंख्यक मामलों के विभाग का जिम्मा आवास मंत्री जितेंद्र आव्हाड को सौंपा जाएगा.,"शनिवार मार्च 19, 2022 05:25 PM IST",NDTV News
115,"महाराष्‍ट्र : पूर्व मंत्री अनिल देशमुख की जमानत याचिका खारिज, कोर्ट ने कहा-उनके खिलाफ पर्याप्‍त सबूत",सेशन जज आरएन रोकड़े ने यह फैसला देते हुए कहा कि पहली नजर में अनिल देशमुख के खिलाफ मनी लांड्रिंग केस के लिए पर्याप्त सबूत हैं. देशमुख फिलहाल मुंबई की आर्थर रोड जेल में न्यायिक हिरासत में हैं. ,"सोमवार मार्च 14, 2022 03:32 PM IST",NDTV News
116,मनी लांड्रिंग मामले में महाराष्‍ट्र के मंत्री नवाब मलिक को 7 मार्च तक ED की हिरासत में भेजा गया,"सुनवाई की शुरुआत करते हुए एडिशनल सॉलिस्टिर जनरल (एएसजी) अनिल सिंह ने कहा कि ईडी की हिरासत के बीच नवाब मलिक की तबीयत खराब होने के वजह से उन्हें कुछ समय के लिए अस्पताल में भर्ती करना पड़ा, जिसके वजह से पूरी इन्क्वारी नहीं हो पाई.","गुरुवार मार्च 3, 2022 03:46 PM IST",NDTV News
117,"महाराष्ट्र : मंत्री नवाब मलिक अस्पताल में भर्ती, दाऊद से जुड़े मामले में हैं ED की हिरासत में","ईडी की हिरासत के दौरान नवाब मलिक ने केंद्रीय एजेंसी के कर्मियों से स्वास्थ्य संबंधी कुछ समस्याओं की शिकायत की, जिसके बाद उन्हें अस्पताल में भर्ती कराया गया.","शुक्रवार फ़रवरी 25, 2022 04:13 PM IST",NDTV News
118,"""कुछ महानायकों को पिता कहा जाता है"" : नवाब मलिक की गिरफ्तारी के बाद उनकी बेटी","मलिक को दक्षिण मुंबई के बलार्ड एस्टेट इलाके में स्थित ईडी के दफ्तर में करीब पांच घंटे तक चली पूछताछ के बाद गिरफ्तार कर लिया गया. बाद में उन्हें विशेष न्यायाधीश के समक्ष पेश किया गया, जिन्होंने उनको तीन मार्च तक ईडी की हिरासत में भेज दिया.","गुरुवार फ़रवरी 24, 2022 01:14 AM IST",NDTV News
119,'तुम्हारा वक्त है... हमारा दौर आएगा!' : गिरफ्तारी के बाद बोले महाराष्ट्र के मंत्री नवाब मलिक,दाऊद इब्राहिम और अंडरवर्ल्ड से जुड़े मनी लॉन्ड्रिंग केस के सिसलिसे में गिरफ्तार नवाब मलिक को आज ईडी ने विशेष अदालत के समक्ष पेश किया गया. अदालत ने नवाब मलिक को 8 दिन यानी 3 मार्च तक ईडी की रिमांड पर भेजा है. ,"बुधवार फ़रवरी 23, 2022 10:13 PM IST",NDTV News
120,महाराष्ट्र के मंत्री नवाब मलिक के बेटे फराज से जुड़ी कंपनी ED के निशाने पर,"महाराष्ट्र सरकार में कैबिनेट मंत्री और एनसीपी के प्रवक्ता नवाब मलिक ने रविवार की रात में ट्वीट करके सोमवार को उनके घर सरकारी मेहमानों के आने की आशंका व्यक्त की थी. उन्होंने यह भी कहा था कि मेहमानों का स्वागत वे चाय-बिस्किट से करेंगे. लेकिन मेहमान तो उनके घर नहीं आए, खुद नवाब मलिक भी सुबह-सुबह हेलीकॉप्टर से बीड चले गए. नवाब मलिक ने बताया कि उनका पार्टी कार्यक्रम पहले से तय था. बहरहाल मेहमान भले उनके घर नहीं आए लेकिन उनके बेटे फराज से जुड़ी एक कंपनी टचवुड रियल स्टेट प्राइवेट लिमिटेड प्रवर्तन निदेशालय, यानी कि ईडी के राडार पर है. सोमवार को दिल्ली से आई टीम यूनियन बैंक ऑफ इंडिया से लोन लेकर उसे घुमाने के मामले में जांच कर रही है.","मंगलवार दिसम्बर 21, 2021 07:42 PM IST",NDTV News
121,"बॉलीवुड एक्ट्रेस शिल्पा शेट्टी और श्रद्धा कपूर से भी जुड़े सुकेश चंद्रशेखर के तार, ED का खुलासा","दिल्ली की पटियाला हाउस कोर्ट ने हाल ही में 200 करोड़ रुपये के मनी लॉन्ड्रिंग मामले में सुकेश चंद्रशेखर, पत्नी लीना मारिया पॉल और अन्य के खिलाफ दायर ईडी की चार्जशीट पर संज्ञान लिया है. फिलहाल सभी आरोपी न्यायिक हिरासत में हैं.","रविवार दिसम्बर 19, 2021 10:54 AM IST",NDTV News
122,200 करोड़ की ठगी मामले के मास्टरमाइंड सुकेश चन्द्रशेखर ने जेल के अंदर खुद की जान को बताया खतरा,उसने पत्र के माध्यम से बताया है कि जेल में उसकी भी अंकित गुर्जर की तरह हत्या करवाई जा सकती है.,"गुरुवार दिसम्बर 16, 2021 03:07 PM IST",NDTV News
123,जैकलीन फर्नांडीज से दोस्ती के लिए ठग ने अमित शाह के ऑफिस नंबर को ‘स्पूफ’ किया : चार्जशीट,ईडी ने धनशोधन रोधी कानून के तहत दाखिल आरोपपत्र में यह जानकारी दी है.,"मंगलवार दिसम्बर 14, 2021 09:27 AM IST",NDTV News
124,मनी लॉन्ड्रिंग केस : अभिनेत्री जैकलीन फर्नांडीज पूछताछ के लिए ईडी दफ्तर पहुंचीं,5 दिसंबर को जैकलीन फर्नांडिस को मुंबई इंटरनेशनल एयरपोर्ट पर हिरासत में लिया गया था. इसके बाद ईडी ने उन्हें 8 दिसंबर के लिए समन जारी किया था.,"बुधवार दिसम्बर 8, 2021 11:44 AM IST",NDTV News
125,"मुंबई : मनी लॉन्ड्रिंग मामले में ईडी की बड़ी कार्रवाई, शिवसेना सांसद के सहयोगी की संपत्ति कुर्क की",एजेंसी ने एक बयान में कहा कि जांच में पाया गया कि ''महिला उत्कर्ष प्रतिष्ठान'' को कंपनी में बदलने के लिए एक साजिश रची गई और धोखाधड़ी वाले तरीके अपनाए गए तथा ट्रस्ट के पैसों का गबन किया गया.,"शुक्रवार नवम्बर 26, 2021 01:02 AM IST",NDTV News
126,मनी लॉन्ड्रिंग केस: अनिल देशमुख के बेटे ऋषिकेश की अर्जी पर सेशन कोर्ट में सुनवाई 4 दिसंबर तक टली,ऋषिकेश को भी प्रवर्तन निदेशालय (ED) अब तक कई बार समन कर चुका है लेकिन कोई न कोई बहाना बनाकर वे अभी तक एक बार भी ED के सामने हाजिर नही हुए हैं. उनको डर है कि पिता की तरहं उनकी भी गिरफ्तारी हो सकती है इसलिए ऋषिकेश में अग्रिम जमानत अर्जी दी है.जिस पर आज होने वाली सुनवाई 4 दिसंबर तक के लिये टल गई,"सोमवार नवम्बर 22, 2021 12:34 PM IST",NDTV News
127,ED ने कथित मनी लॉन्डरिंग केस में IREO ग्रुप चेयरमैन ललित गोयल को गिरफ्तार किया,"साल 2010 में ललित गोयल ने 73 मिलियन अमेरिकी डॉलर अलग-अलग ट्रस्ट में स्थानांतरित किए थे, जिसकी ED जांच कर रही थी. ये पैसा निवेशकों का था.","मंगलवार नवम्बर 16, 2021 03:04 PM IST",NDTV News
128,"महाराष्ट्र के पूर्व गृहमंत्री 14 दिन की न्यायिक हिरासत में, घर का खाना मांगने पर कोर्ट ने कहा- 'पहले जेल का खाना खाइए...'","अनिल देशमुख की तरफ से जेल में घर के भोजन का आवेदन दिया गया है. अदालत का कहना है पहले आप जेल का खाना खाइए, सही नहीं रहा, तब मैं विचार करूंगा. साथ में मेडिकल कंडीशन को देखते हुए बेड की मांग की गई थी, जिसकी अनुमति कोर्ट ने दे दी है.","सोमवार नवम्बर 15, 2021 03:07 PM IST",NDTV News
129,"महाराष्ट्र के पूर्व गृहमंत्री अनिल देशमुख की ED की हिरासत आज हो रही है खत्म, अब CBI मांग सकती है कस्टडी","पिछली बार ED ने सचिन वझे के साथ आमने सामने पूछताछ के लिए हिरासत बढ़ाकर मांगी थी, लेकिन सचिन वझे अब भी मुम्बई क्राइम ब्रांच की कस्टडी में है इसलिए आमने-सामने पूछताछ नहीं हो पायी है.","सोमवार नवम्बर 15, 2021 12:52 PM IST",NDTV News
130,"'आपने क्या किया था जब...', मंत्री की गिरफ्तारी पर शरद पवार ने ममता बनर्जी से पूछा","नवाब मलिक की गिरफ्तारी के मामले में ममता बनर्जी ने NCP चीफ शरद पवार को फोन किया. यह कॉल करीब 10 मिनट चली. इस दौरान, तृणमूल कांग्रेस चीफ ममता बनर्जी ने समर्थन और एकजुटता व्यक्त की.","गुरुवार फ़रवरी 24, 2022 06:41 AM IST",NDTV News
131,महाराष्ट्र के मंत्री नवाब मलिक को क्यों किया गया गिरफ्तार? यहां देखें- पूरी डिटेल,प्रवर्तन निदेशालय के सूत्रों ने कहा कि कुछ सबूतों से पता चला है कि नवाब मलिक और दाऊद इब्राहिम के सहयोगियों के बीच लेनदेन हुआ था.,"बुधवार फ़रवरी 23, 2022 06:48 PM IST",NDTV News
132,"महाठग सुकेश चंद्रशेखर ने जैकलीन फर्नांडिस को हीरे की अंगूठी देकर किया था प्रपोज, सारा-जाह्नवी भी थीं निशाने पर","पिंकी ने सुकेश के संपर्क में रहने के लिए उसे मनाने के लिए जैकलीन फर्नांडीस के मेकअप आर्टिस्ट (शान मुथाथिल) की मदद ली. पिंकी ईरानी सुकेश की निजी खरीददार बन गईं और वीडियो कॉल (जेल से) की मदद से उसने जैकलीन फर्नांडीस के लिए क्रिश्चियन डायर, एलवी, हर्मेस आदि से गिफ्ट खरीदे.","बुधवार फ़रवरी 23, 2022 04:38 PM IST",NDTV News
133,"ED की रिमांड में रहेंगे मंत्री नवाब मलिक, महाराष्ट्र सरकार बोली- 'इस्तीफे का सवाल ही नहीं क्योंकि...'","महाराष्ट्र सरकार में मंत्री और एनसीपी के वरिष्ठ नेता नवाब मलिक (Nawab Malik) को प्रवर्तन निदेशालय (ED) ने बुधवार को गिरफ्तार किया. मंत्री नवाब मलिक को आठ दिन तक प्रवर्तन निदेशालय की रिमांड पर भेजा गया हैं. वे 3 मार्च तक ईडी की हिरासत में रहेंगे. मुंबई अंडरवर्ल्ड, भगोड़े गैंगस्टर दाऊद इब्राहिम (Dawood Ibrahim) और उसके गुर्गों की गतिविधियों से जुड़े मनी लॉन्ड्रिंग मामले में ईडी ने पूछताछ के बाद मलिक को गिरफ्तार किया था.","बुधवार फ़रवरी 23, 2022 11:08 PM IST",NDTV News
134,"महाराष्ट्र के मंत्री, NCP नेता नवाब मलिक गिरफ्तार",महाराष्‍ट्र सरकार के मंत्री और राष्‍ट्रवादी कांग्रेस पार्टी (NCP) नेता नवाब मलिक को मनी लांड्रिंग मामले में गिरफ्तार कर लिया गया है. मामले में आज हुई पूछताछ के बाद उनकी गिरफ्तारी की गई.,"बुधवार फ़रवरी 23, 2022 04:02 PM IST",NDTV News
135,डी कंपनी मनी लॉन्ड्रिंग केस : ED ने अंडरवर्ल्ड डॉन दाऊद के भाई इकबाल कासकर को हिरासत में लिया,"ईडी को शक है कि डी कंपनी से जुड़े लोग वसूली, सेटलमेंट, और ड्रग्स के माध्यम से  पैसे जमा करते हैं और उसका इस्तेमाल हवाला के जरिए आतंकी गतिविधि के लिए करते हैं.","शुक्रवार फ़रवरी 18, 2022 11:19 AM IST",NDTV News
136,देश के सबसे बड़े बैंक घोटाले में CBI ने मुख्य आरोपी ऋषि अग्रवाल से पूछताछ की: सूत्र,"देश के सबसे बड़े बैंक घोटाले में CBI ने मुख्य आरोपी ऋषि अग्रवाल से पूछताछ की. सूत्रों ने बताया कि शनिवार को छापेमारी के वक्त ऋषि अग्रवाल अपने मुंबई स्थित घर पर थे और उन्होंने तलाशी अभियान के दौरान सहयोग किया. अग्रवाल ने पंचनामा इत्यादि कागजातों पर हस्ताक्षर भी किए. तलाशी के बाद, सीबीआई ने सोमवार को समन जारी किया और पूछताछ की गई.","गुरुवार फ़रवरी 17, 2022 09:21 PM IST",NDTV News
137,'पूर्व गृह मंत्री देशमुख के आदेश पर उनके सहायकों को दिए पैसे' : सचिन वाजे ने जांच पैनल को बताया,"सचिन वाजे ने दावा किया, “मुझे तत्कालीन गृह मंत्री अनिल देशमुख द्वारा हमेशा गंभीर मानसिक प्रताड़ना और उत्पीड़न का शिकार होना पड़ा है.” वाजे के हलफनामे में कहा गया, “मैं देशमुख के हाथों ‘स्टॉकहोम सिंड्रोम’ से पीड़ित हूं, जो आज भी मुझ पर, मेरे जीवन, मेरे भविष्य और मेरे आसपास की परिस्थितियों पर जबरदस्त शक्ति और दबदबा रखते हैं.”","गुरुवार फ़रवरी 10, 2022 03:20 AM IST",NDTV News
138,महाराष्ट्र के पूर्व गृह मंत्री के खिलाफ ED केस में सरकारी गवाह बनना चाहता है सचिन वाजे,"एंटीलिया विस्फोटक मामले में वर्तमान में न्यायिक हिरासत में चल रहा वाजे धनशोधन मामले में भी एक आरोपी है, जिसमें देशमुख को गिरफ्तार किया गया है. ईडी के सहायक निदेशक तासीन सुल्तान को लिखे अपने पत्र में वाजे ने कहा, “मैं एक सक्षम मजिस्ट्रेट के समक्ष उपरोक्त संदर्भित मामले के संबंध में मुझे ज्ञात सभी तथ्यों का सत्य और स्वैच्छिक प्रकटीकरण करने को तैयार हूं.”","गुरुवार फ़रवरी 10, 2022 03:13 AM IST",NDTV News
139,"मनी लॉन्ड्रिंग केस : ईडी की चार्जशीट में जैकलीन का अभियोजन गवाह के रूप में उल्लेख नहीं, नोरा फतेही को मिली राहत", ईडी का कहना है कि जैकलीन की भूमिका की जांच की जा रही है. ईडी दूसरी अभियोजन शिकायत दर्ज करेगा.,"बुधवार दिसम्बर 22, 2021 12:11 PM IST",NDTV News
140,"महाराष्ट्र के पूर्व गृह मंत्री अनिल देशमुख को मनी लॉन्ड्रिंग केस में राहत नहीं, 15 नवंबर तक ED हिरासत",महाराष्ट्र के पूर्व गृह मंत्री अनिल देशमुख को आज अदालत से राहत नहीं मिली. कोर्ट ने अनिल देशमुख को ईडी हिरासत 15 नवंबर तक बढ़ा दी है. अनिल देशमुख ने अदालत में जज को एक लिखित पत्र दिया था. उन्होंने कहा कि ईडी ने मुझे 10 दिन से रखा है. इस दौरान 200 से ज्यादा सवाल पूछे गए हैं. मेरे पास बताने को अब कुछ नहीं है जो ED को चाहिए. इसके लिए ED कस्टडी ना दी जाए.,"शुक्रवार नवम्बर 12, 2021 02:13 PM IST",NDTV News
